[
  {
    "id": "claim:001-rothera-viral-novelty",
    "source_id": "src:piedade-2024-antarctic-viral-seascape",
    "subject": "region:rothera-time-series",
    "predicate": "harbours",
    "object": "realm:viruses",
    "statement": "The Rothera coastal time series yielded 7,957 mid- to high-quality vOTUs, about 75% of which lacked species-level representation in the comparison ocean-virus catalogues.",
    "scope": "Fifteen-metre samples from two productive-season windows in 2018–2019 at one West Antarctic Peninsula site.",
    "evidence_type": "reported",
    "evidence_basis": "Paired virus-enriched and cellular-fraction assemblies with catalogue comparison.",
    "locator": "Results: viral diversity and novelty",
    "confidence": "high",
    "confidence_note": "Direct assembly result; novelty remains conditional on catalogues and clustering thresholds.",
    "qualifiers": {"vOTUs": 7957, "unrepresented_fraction_approx": 0.75}
  },
  {
    "id": "claim:002-ross-shelf-virus-hosts",
    "source_id": "src:lopez-simon-2023-ross-ice-shelf-viruses",
    "subject": "realm:viruses",
    "predicate": "infects_or_targets",
    "object": "taxon:nitrosopumilus",
    "statement": "Viral genomes beneath the Ross Ice Shelf were computationally linked to ammonia-oxidizing Nitrosopumilus hosts, alongside transcriptional evidence that viruses were active.",
    "scope": "Sub-ice-shelf water from the sampled Ross Ice Shelf cavity; host links are genome-based predictions.",
    "evidence_type": "inferred",
    "evidence_basis": "Integrated viral genomes, predicted host connections, and metatranscriptomic detection.",
    "locator": "Results: host predictions and viral activity",
    "confidence": "moderate",
    "confidence_note": "Multiple sequence-based signals support the link, but infection was not validated in culture."
  },
  {
    "id": "claim:003-antarctic-soil-antiviral-defense",
    "source_id": "src:van-goethem-2025-antarctic-immune-systems",
    "subject": "habitat:polar-soil",
    "predicate": "harbours",
    "object": "process:antiviral-defense",
    "statement": "Pristine Antarctic soil metagenomes contained diverse Class 1 CRISPR–Cas systems and divergent Class 2 type-V architectures, including unusual Cas12-like effectors.",
    "scope": "Recovered bacterial genomes from the sampled high-latitude Antarctic soils.",
    "evidence_type": "inferred",
    "evidence_basis": "Genome-resolved annotation of CRISPR arrays, Cas architecture, and protein phylogeny.",
    "locator": "Results: CRISPR–Cas diversity and phylogeny",
    "confidence": "moderate",
    "confidence_note": "System architecture is well supported by sequence analysis; defense performance was not measured in situ."
  },
  {
    "id": "claim:004-polar-lakes-giant-viruses",
    "source_id": "src:pitot-2024-polar-lake-giant-viruses",
    "subject": "habitat:lake",
    "predicate": "harbours",
    "object": "taxon:nucleocytoviricota",
    "statement": "A comparative survey of polar and temperate lakes recovered 3,304 giant-virus MAGs spanning all recognized Nucleocytoviricota orders and found strong lake-level endemism.",
    "scope": "Twenty lakes across Canadian Arctic/subarctic, Antarctic, and temperate settings represented by heterogeneous metagenomic datasets.",
    "evidence_type": "reported",
    "evidence_basis": "Metagenome assembly, giant-virus genome identification, phylogenomics, and population clustering.",
    "locator": "Abstract; Results: genome recovery and biogeography",
    "confidence": "high",
    "confidence_note": "Genome recovery and comparative clustering are direct; completeness depends on sampling and assembly."
  },
  {
    "id": "claim:005-contamination-caudoviricetes",
    "source_id": "src:frere-martiniuc-2025-king-george-virome",
    "subject": "driver:hydrocarbon-contamination",
    "predicate": "increases",
    "object": "taxon:caudoviricetes",
    "statement": "Caudoviricetes accounted for more than 90% of viral relative abundance in contaminated King George Island soils, compared with less than 62% in uncontaminated soils.",
    "scope": "The sampled hydrocarbon-contamination transect on King George Island; relative sequence abundance rather than virion counts.",
    "evidence_type": "reported",
    "evidence_basis": "Comparative soil metagenomes analyzed against measured PAH contamination.",
    "locator": "Results: viral composition across the contamination gradient",
    "confidence": "moderate",
    "confidence_note": "The within-study contrast is direct, but compositional data and a single transect limit causal generalization.",
    "qualifiers": {"contaminated_relative_abundance_gt": 0.90, "uncontaminated_relative_abundance_lt": 0.62}
  },
  {
    "id": "claim:006-arctic-virus-seasonality",
    "source_id": "src:calayag-2025-arctic-virus-seasonality",
    "subject": "realm:viruses",
    "predicate": "associated_with",
    "object": "process:microbial-seasonality",
    "statement": "At the HAUSGARTEN Arctic time-series site, viral community composition recurred annually and tracked prokaryotic community composition across four years.",
    "scope": "Cellular-fraction long-read metagenomes from one Fram Strait observatory; four annual cycles.",
    "evidence_type": "reported",
    "evidence_basis": "Repeated metagenomic coverage and community-composition comparisons through time.",
    "locator": "Results: interannual recurrence and virus–host seasonality",
    "confidence": "high",
    "confidence_note": "Dense multi-year observations support recurrence; cellular filtration under-recovers free viral particles."
  },
  {
    "id": "claim:007-microlayer-viral-cold-potential",
    "source_id": "src:rahlff-2024-arctic-surface-microlayer",
    "subject": "realm:viruses",
    "predicate": "encodes_potential_for",
    "object": "process:cold-adaptation",
    "statement": "Arctic sea-surface-microlayer vOTUs encoded candidate ice-binding and glycerol-related auxiliary genes that could contribute to cryoprotection.",
    "scope": "Sequence predictions from surface-microlayer and underlying-water samples; function was not biochemically validated.",
    "evidence_type": "inferred",
    "evidence_basis": "Viral genome annotation and auxiliary-metabolic-gene screening.",
    "locator": "Results: candidate auxiliary metabolic genes",
    "confidence": "moderate",
    "confidence_note": "Gene annotations are plausible but do not demonstrate expression, host benefit, or cryoprotection."
  },
  {
    "id": "claim:008-active-peat-virus-hosts",
    "source_id": "src:trubl-2021-arctic-peat-viruses",
    "subject": "realm:viruses",
    "predicate": "infects_or_targets",
    "object": "realm:bacteria",
    "statement": "Stable-isotope probing identified 243 active viral populations under anoxic sub-freezing peat conditions, with one-third linked to active bacterial populations.",
    "scope": "Laboratory incubation of Bonanza Creek peat under the reported anoxic sub-freezing treatment.",
    "evidence_type": "inferred",
    "evidence_basis": "Stable-isotope incorporation, metagenomic population recovery, and virus–host linkage.",
    "locator": "Results: active viral populations and host links",
    "confidence": "moderate",
    "confidence_note": "Isotope labeling provides activity evidence, while individual virus–host assignments remain inferential.",
    "qualifiers": {"active_viral_populations": 243, "linked_fraction_approx": 0.333}
  },
  {
    "id": "claim:009-permafrost-pithovirus",
    "source_id": "src:rigou-2022-permafrost-giant-viruses",
    "subject": "habitat:permafrost",
    "predicate": "harbours",
    "object": "taxon:pithoviridae",
    "statement": "Ancient Siberian permafrost metagenomes contained prominent Pithoviridae-like sequences, including a complete 1.6-Mb circular genome from an approximately 42,000-year-old sample.",
    "scope": "The analyzed permafrost samples; sequence recovery does not establish present infectivity.",
    "evidence_type": "reported",
    "evidence_basis": "Metagenomic assembly, genome circularization, abundance profiling, and phylogenomics.",
    "locator": "Results: giant-virus abundance and genome recovery",
    "confidence": "high",
    "confidence_note": "The genomic sequence is direct; age belongs to sample context and viability was not tested."
  },
  {
    "id": "claim:010-temperature-polar-giant-virus",
    "source_id": "src:meng-2023-polar-giant-virus-adaptation",
    "subject": "driver:temperature",
    "predicate": "associated_with",
    "object": "process:cold-adaptation",
    "statement": "Global comparative analyses separated polar from non-polar giant-virus communities and identified temperature as a major correlate of virus–host network structure.",
    "scope": "Global metagenomic comparison and ancestral-niche reconstruction across sampled environments.",
    "evidence_type": "inferred",
    "evidence_basis": "Community biogeography, ecological network analysis, phylogenomics, and ancestral-state reconstruction.",
    "locator": "Results: environmental boundary and ancestral niches",
    "confidence": "moderate",
    "confidence_note": "Multiple analyses agree, but temperature covaries with habitat and does not alone demonstrate mechanism."
  },
  {
    "id": "claim:011-arctic-viable-giant-viruses",
    "source_id": "src:queiroz-2026-arctic-giant-virus-isolates",
    "subject": "pole:arctic",
    "predicate": "harbours",
    "object": "taxon:marseilleviridae",
    "statement": "Culture-based screening isolated five marseilleviruses and five megaviruses from diverse natural and human-influenced sites above the Arctic Circle.",
    "scope": "Sampled habitats in northern Norway; isolation demonstrates viability under the culture system used.",
    "evidence_type": "reported",
    "evidence_basis": "Host-cell culture, microscopy, and viral genome sequencing.",
    "locator": "Abstract; Results: virus isolation and characterization",
    "confidence": "high",